{
  "schema_version": "1.0.0",
  "metadata": {
    "company": "普天科技",
    "company_name": "普天科技",
    "stock_code": "002544",
    "industry": "信息通信",
    "report_title": "普天科技（002544）深度研究报告",
    "report_date": "2025-10-28",
    "source_file": "002544_2025-10-28.md"
  },
  "sources": [
    {
      "source_id": "src_002544_2025-10-28",
      "type": "broker_report",
      "title": "普天科技（002544）深度研究报告",
      "publisher": "民生证券",
      "published_date": "2025-10-28",
      "file_name": "002544_2025-10-28.md"
    }
  ],
  "slides": [
    {
      "slide_id": "slide_001",
      "page_role": "title",
      "slide_type": "company_overview",
      "section": "",
      "title": "普天科技（002544）深度研究报告",
      "key_message": "普天科技作为中国电科控股的卫星互联网“国家队”，战略转型空天地一体化，业绩拐点将至，维持“推荐”评级。",
      "bullet_points": [],
      "source_refs": [
        "src_002544_2025-10-28"
      ],
      "layout_hint": "封面页，包含公司名称、股票代码、报告标题和核心观点",
      "visual_candidates": []
    },
    {
      "slide_id": "slide_002",
      "page_role": "content",
      "slide_type": "summary",
      "section": "",
      "title": "投资建议：卫星互联网卡位优势明显，盈利拐点确立",
      "key_message": "预计2025-2027年归母净利润分别为1.08/1.45/2.01亿元，当前高PE源于利润低谷，随盈利修复将快速消化，维持“推荐”评级。",
      "bullet_points": [
        "公司参与CCSA标准制定，完成“无信关站”手持机直连卫星样机研制，技术先发优势显著。",
        "卫星互联网行业政策驱动与商业需求共振，公司有望受益于产业链加速建设。",
        "2024年业绩触底，2025年将迎来盈利与现金流双重拐点。"
      ],
      "source_refs": [
        "src_002544_2025-10-28"
      ],
      "layout_hint": "标题居中，下方两列或三列列出核心观点",
      "visual_candidates": []
    },
    {
      "slide_id": "slide_003",
      "page_role": "content",
      "slide_type": "company_overview",
      "section": "",
      "title": "战略升维：从地面通信服务商向空天地一体化平台转型",
      "key_message": "公司前身为七所民品，中国电科绝对控股，定位为集团内协外联主门户，业务结构从专网驱动转向公网+智能制造双轮支撑。",
      "bullet_points": [
        "公司以通信规划设计起步，形成公网通信、专网通信与智慧应用、智能制造三大业务板块。",
        "2024年收入49.73亿元，专网占比45%、公网32%、智能制造23%；毛利率17.1%。",
        "战略转型聚焦卫星互联网、低空经济等新兴赛道，打开中长期成长天花板。"
      ],
      "source_refs": [
        "src_002544_2025-10-28"
      ],
      "layout_hint": "左侧文字描述，右侧可放置公司发展历程时间线或关键数据",
      "visual_candidates": []
    },
    {
      "slide_id": "slide_004",
      "page_role": "content",
      "slide_type": "business_model",
      "section": "",
      "title": "三大业务板块分化，智能制造盈利最强，专网收缩拖累营收",
      "key_message": "公网通信稳中有升但毛利率低，专网通信收入大幅萎缩但仍维持较高毛利，智能制造毛利率领先但收入规模下滑，整体结构向均衡发展。",
      "bullet_points": [
        "专网通信：2024年收入22.42亿元（-19%），毛利率18.6%；收入连续三年下降，承压明显。",
        "公网通信：2024年收入15.81亿元（+6%），毛利率10.6%；受益5G深度覆盖，有望稳健增长。",
        "智能制造：2024年收入11.49亿元（-4%），毛利率23.3%；聚焦高可靠PCB和时频器件，受益卫星互联网。"
      ],
      "source_refs": [
        "src_002544_2025-10-28"
      ],
      "layout_hint": "左上方为柱状图展示各业务收入变化，右下方列出关键毛利率数据",
      "visual_candidates": [
        {
          "candidate_id": "visual_001",
          "type": "chart",
          "description": "2019-2024年三大业务收入占比变化图，展示专网通信下降、公网与智能制造提升的趋势",
          "source_refs": [
            "src_002544_2025-10-28"
          ]
        }
      ]
    },
    {
      "slide_id": "slide_005",
      "page_role": "content",
      "slide_type": "core_competitiveness",
      "section": "",
      "title": "中国电科“国家队”背景构筑差异化竞争壁垒",
      "key_message": "依托中国电科的全产业链技术资源，公司拥有全链条资质、专利储备和垂直一体化协同优势，形成难以复制的竞争护城河。",
      "bullet_points": [
        "拥有电子通信全链条一级资质，网规网优全国最大独立第三方设计院。",
        "累计专利申请超1660件，授权专利1080余件，具备5G设备全国产化能力。",
        "“基础元器件—通信设备—行业解决方案—运营服务”垂直产业链，实现成本协同与高效交付。"
      ],
      "source_refs": [
        "src_002544_2025-10-28"
      ],
      "layout_hint": "左右分栏：左侧列出股东赋能和资质，右侧列出技术壁垒和垂直一体化优势",
      "visual_candidates": []
    },
    {
      "slide_id": "slide_006",
      "page_role": "content",
      "slide_type": "industry_analysis",
      "section": "",
      "title": "低轨星座组网加速，公司卡位地面设备价值链核心环节",
      "key_message": "国内卫星互联网进入规模化组网阶段，地面设备环节价值量占比最高，公司手持机直连卫星、PDT星通站等产品精准卡位。",
      "bullet_points": [
        "2025年两大星座预计发射700-800颗，地面站和终端需求将率先放量。",
        "公司已完成“无信关站”手持机直连低轨卫星样机研制，大幅降低卫星通信门槛。",
        "PDT星通站实现专网与卫星通信融合，为应急通信提供高可靠解决方案。"
      ],
      "source_refs": [
        "src_002544_2025-10-28"
      ],
      "layout_hint": "页面顶部为标题，中部展示全球卫星产业收入占比图，底部列出公司产品矩阵",
      "visual_candidates": [
        {
          "candidate_id": "visual_002",
          "type": "chart",
          "description": "全球卫星产业各环节收入占比图（参考SIA数据），突出地面设备占比超过50%",
          "source_refs": [
            "src_002544_2025-10-28"
          ]
        }
      ]
    },
    {
      "slide_id": "slide_007",
      "page_role": "content",
      "slide_type": "financial_forecast",
      "section": "",
      "title": "盈利预测：2025年收入重回增长，毛利率小幅改善",
      "key_message": "预计2025-2027年营收增速分别为10%、11%、11%，毛利率稳定在17%左右，归母净利润从0.11亿跃升至2.01亿元。",
      "bullet_points": [
        "公网通信：受益5G和卫星互联网，预计收入增速15%，毛利率维持11%。",
        "专网通信与智慧应用：受短期压力，预计增速5%，毛利率恢复至19%。",
        "智能制造：PCB景气复苏与高端化，预计增速15%，毛利率保持23%。"
      ],
      "source_refs": [
        "src_002544_2025-10-28"
      ],
      "layout_hint": "页面中心放置三大业务预测表格，下方附注关键假设",
      "visual_candidates": [
        {
          "candidate_id": "visual_003",
          "type": "table",
          "description": "普天科技收入及毛利率拆分预测表，包含三大板块2024-2027年收入和毛利率",
          "source_refs": [
            "src_002544_2025-10-28"
          ]
        }
      ]
    },
    {
      "slide_id": "slide_008",
      "page_role": "content",
      "slide_type": "valuation_analysis",
      "section": "",
      "title": "盈利与现金流双重拐点确立，PE高企因利润基数极低",
      "key_message": "机构一致预期口径下，2024年归母净利润仅0.11亿，2025E/2026E/2027E分别为0.97/1.89/2.61亿元，经营现金流同步大增，高PE将随盈利跳跃式下降。",
      "bullet_points": [
        "2025-2027年归母净利润增速分别为782%、95%、38%，PE从160倍降至59倍。",
        "经营活动现金流从0.56亿增至4.01亿元，自由现金流转正。",
        "ROE从0.3%提升至6.5%，估值回归合理区间。"
      ],
      "source_refs": [
        "src_002544_2025-10-28"
      ],
      "layout_hint": "左侧放置盈利与现金流变化折线图，右侧列出PE和ROE变化表",
      "visual_candidates": [
        {
          "candidate_id": "visual_004",
          "type": "chart",
          "description": "2024-2027年归母净利润、经营现金流及PE变化趋势图",
          "source_refs": [
            "src_002544_2025-10-28"
          ]
        }
      ]
    },
    {
      "slide_id": "slide_009",
      "page_role": "content",
      "slide_type": "valuation_analysis",
      "section": "",
      "title": "可比公司TTM PE失真，普天科技2025年预测PE具性价比",
      "key_message": "卫星互联网行业可比公司PE普遍畸高，普天科技TTM PE约1588倍，但2025年预测PE仅143倍，低于可比均值，随盈利兑现估值有望快速消化。",
      "bullet_points": [
        "可比公司中4家亏损，正PE均值239倍，中位数194倍。",
        "公司2025年预测PE 143倍（民生证券预测），低于多数可比公司。",
        "千帆星座组网加速、手持机直连卫星等催化剂驱动估值修复。"
      ],
      "source_refs": [
        "src_002544_2025-10-28"
      ],
      "layout_hint": "上部为可比公司PE表格，下部为简要分析文字",
      "visual_candidates": [
        {
          "candidate_id": "visual_005",
          "type": "table",
          "description": "卫星互联网可比公司PE(TTM)对比表，包括国博电子、中国卫通等",
          "source_refs": [
            "src_002544_2025-10-28"
          ]
        }
      ]
    },
    {
      "slide_id": "slide_010",
      "page_role": "content",
      "slide_type": "investment_risk",
      "section": "",
      "title": "风险提示：卫星互联网商业化不及预期，竞争加剧挤压盈利",
      "key_message": "卫星互联网建设进度、行业竞争和商业模式不确定性是主要风险，公司短期盈利承压，需关注订单落地和毛利率改善节奏。",
      "bullet_points": [
        "卫星互联网产业仍处早期，星座建设受成本、发射能力等因素制约，公司相关业务尚未形成独立收入。",
        "通信技术服务领域竞争加剧，公网通信毛利率仅10.6%，智能制造毛利率三年下滑超15个百分点。",
        "运营商订单季节性波动明显，业绩低基数下可能放大短期波动。"
      ],
      "source_refs": [
        "src_002544_2025-10-28"
      ],
      "layout_hint": "列表形式列出三大风险，每个风险点配简要说明",
      "visual_candidates": []
    },
    {
      "slide_id": "slide_011",
      "page_role": "closing",
      "slide_type": "summary",
      "section": "",
      "title": "维持“推荐”评级：技术卡位明确，业绩拐点来临",
      "key_message": "普天科技作为卫星互联网地面设备核心供应商，央企背景与全产业链优势显著，预计2025年盈利大幅反转，估值具备吸引力。",
      "bullet_points": [
        "公司深度参与卫星互联网标准与产品研发，手持机直连卫星样机完成，PDT星通站实现专网卫星融合。",
        "公网通信稳健增长，智能制造受益卫星与低空经济，专网通信有望逐步修复。",
        "民生证券预计2025-2027年归母净利润为1.08/1.45/2.01亿元，PE从143倍降至77倍。"
      ],
      "source_refs": [
        "src_002544_2025-10-28"
      ],
      "layout_hint": "居中显示公司核心优势与投资结论，配合评级图标",
      "visual_candidates": []
    }
  ]
}
